{
 "id": "c3d4e5f6-a7b8-9012-cdef-012345678901",
 "tenant_id": "acme-corp",
 "domain": "plasticos",
 "batch_run_id": "batch-2026-04-05",
 "field_name": "recycler_certification",
 "field_type": "string",
 "source": "perplexity_sonar",
 "fill_rate": 0.73,
 "avg_confidence": 0.81,
 "sample_values": [
  "ISO 14001",
  "R2v3",
  "eStewards"
 ],
 "value_distribution": {
  "ISO 14001": 120,
  "R2v3": 45,
  "eStewards": 22
 },
 "proposed_gate": "recycler_certification is not null",
 "proposed_scoring_dimension": "fit",
 "yaml_diff": "+ recycler_certification:\n+ type: string\n+ gate: required",
 "approval_status": "pending",
 "reviewed_by": null,
 "reviewed_at": null,
 "created_at": "2026-04-05T18:00:00Z"
}
